Date,Category,Rank,Product,Stars,N_Opinions,Price
28/10/2020,Películas y TV,68,La familia Addams (2019) (DVD),4.5,11,9.99
28/10/2020,Películas y TV,69,Hocus Pocus: 25Th Anniversary Edition [Edizione: Stati Uniti] [Blu-ray],4.5,12563,26.91
28/10/2020,Películas y TV,70,Piratas Del Caribe: La Venganza De Salazar [DVD],4.8,179,8.99
28/10/2020,Películas y TV,71,Toy Story (Edición especial) [DVD],4.7,165,9.99
28/10/2020,Películas y TV,72,Dragon Ball Sagas Completas Box 1 Ep. 1 A 68 En 16 [DVD],4.7,199,59.99
28/10/2020,Películas y TV,73,Saint Seiya Serie Clásica Completa. Episodios 1 A 114. [DVD],4.8,44,68.90
28/10/2020,Películas y TV,74,Drácula 1958 The Horror of Dracula BD nueva edición con Funda y 8 Postales. Edición Limitada y Numerada [Blu-ray],4.8,34,12.99
28/10/2020,Películas y TV,75,Bitelchus Edición 20 Aniversario Blu-Ray- Iconic [Blu-ray],4.7,80,11.94
28/10/2020,Películas y TV,76,Ad Astra 4k Uhd [Blu-ray],4.3,51,24.99
28/10/2020,Películas y TV,77,Aladdín [DVD],4.8,374,17.99
28/10/2020,Películas y TV,78,Spider-Man: Lejos de casa (BD) [Blu-ray],4.8,2719,14.99
28/10/2020,Películas y TV,79,Pack: Audrey Hepburn (9 discos) [DVD],4.9,10,29.99
28/10/2020,Películas y TV,80,La Morada del Miedo BD 2005 The Amityville Horror [Blu-ray],,,12.99
28/10/2020,Películas y TV,81,Vengadores: Endgame [DVD],4.8,882,17.99
28/10/2020,Películas y TV,82,Star Wars: Los últimos Jedi (Edición remasterizada) 2 discos (película + extras) [Blu-ray],4.6,33,13.99
28/10/2020,Películas y TV,83,Aves de Presa (Y la fantabulosa emancipación de Harley Quinn) [DVD],4.5,61,14.99
28/10/2020,Películas y TV,84,Parque Jurásico 1-5 [DVD],4.8,195,29.99
28/10/2020,Películas y TV,85,Pack Bond Daniel Craig Blu-Ray [Blu-ray],4.6,72,21.69
28/10/2020,Películas y TV,86,It Capítulo 2 [DVD],4.7,102,6.99
28/10/2020,Películas y TV,87,V Coleccion Completa [DVD],4.6,131,25.19
28/10/2020,Películas y TV,88,"Frozen,El Reino Del Hielo [DVD]",4.7,537,9.99
28/10/2020,Películas y TV,89,Los santos inocentes Edición Especial [DVD],4.7,28,10.99
28/10/2020,Películas y TV,90,Interstellar [DVD],4.7,46,8.99
28/10/2020,Películas y TV,91,Hereditary [Blu-ray],4.3,196,16.99
28/10/2020,Películas y TV,92,Jovenes Y Brujas - Bd [Blu-ray],4.6,31,12.99
28/10/2020,Películas y TV,93,Mad Max. Furia En La Carretera 4k Uhd [Blu-ray],4.5,44,20.97
28/10/2020,Películas y TV,94,Águila de Acero BLU RAY 1986 Iron Eagle [Blu-ray],4.5,17,12.99
28/10/2020,Películas y TV,95,El Faro (BD) [Blu-ray],4.5,256,13.99
28/10/2020,Películas y TV,96,Mascotas 2 [DVD],4.8,191,9.99
28/10/2020,Películas y TV,97,Sonrisas Y Lagrimas [DVD],4.7,120,8.99
28/10/2020,Películas y TV,98,Los visitantes de la noche [Blu-ray],5.0,1,14.83
28/10/2020,Películas y TV,99,Pack Lo Que El Viento Se Llevo + Casablanca [DVD],4.6,39,9.99
28/10/2020,Películas y TV,100,Frozen 2 [Blu-ray],4.8,637,19.00
28/10/2020,Productos Handmade,1,Bolas de navidad de madera personalizadas cordel incluido Adornos navideños Ornamento Decoraciones colgantes de Navidad para el árbol de Navidad,4.8,434,4.50
28/10/2020,Productos Handmade,2,"Marco de la mirilla para la puerta. Réplica artesanal para tu entrada, como la que tenían en la serie Monica y Rachel.",4.9,1226,20.90
28/10/2020,Productos Handmade,3,Sello marcador ropa personalizado niños Elige entre 9 Diseños Exclusivos,4.6,504,20.90
28/10/2020,Productos Handmade,4,Mascarilla negra higiénica homologada UNE 0065 adulto T-M con filtro fijo lavable_marca: Brissa España,4.1,64,10.00
28/10/2020,Productos Handmade,5,"Velas de cumpleaños personalizadas. Escoge el nombre, edad y el color de las velas.",4.5,131,9.99
28/10/2020,Productos Handmade,6,Ratoncito Pérez puerta gris a su casita con escalera y cajita para diente de leche. Hecha en España,4.8,44,14.95
28/10/2020,Productos Handmade,7,Mascarilla higiénica de tela infantil homologada UNE 0065 niño 10-12 años con filtro fijo lavable_marca: Brissa España,3.8,6,12.00
28/10/2020,Productos Handmade,8,Acondicionador sólido artesanal y ecológico,4.2,158,7.90
28/10/2020,Productos Handmade,9,Bola de navidad personalizad para árbol. Adorno navideño original.,4.6,92,3.85
28/10/2020,Productos Handmade,10,"Pack de 3, Cubrebocas para Niños 7-11 Años, Hecho a Mano de 100% Algodon, Cubre Boca de Alta Calidad",5.0,2,12.19
28/10/2020,Productos Handmade,11,Mascarilla higiénica infantil homologada UNE 0065 niña 5-6-7 años con filtro fijo lavable_marca: Brissa España,4.0,11,12.00
28/10/2020,Productos Handmade,12,Pack 10 un. Cubrebocas reutilizable neopreno,3.3,23,20.00
28/10/2020,Productos Handmade,13,Mascarilla higiénica infantil homologada UNE 0065 niña 7-8-9 años con filtro fijo lavable_marca: Brissa España,3.6,12,12.00
28/10/2020,Productos Handmade,14,"Tabaquera repelente al agua - Pitillera tabaco de liar con bolsillos para filtros, papel y mechero",4.5,897,15.99
28/10/2020,Productos Handmade,15,Puerta Ratón Pérez mágica. Regalo original niño niña Ratoncito Pérez. Hecho a mano en España,4.5,18,8.75
28/10/2020,Productos Handmade,16,"Nombres Decorativos Personalizados de madera para Decoración del Hogar, Comunión, Boda, Cumpleaños y Habitación de Bebe infantil de 25/35/45cm satinados",4.5,125,13.95
28/10/2020,Productos Handmade,17,Rosa Eterna de Hierro Forjado Gris - Forjada a Mano,4.7,21,26.95
28/10/2020,Productos Handmade,18,Bálsamo de Tigre,4.5,18,4.90
28/10/2020,Productos Handmade,19,Collar con nombre personalizado en plata de ley 925.-RINCONDELARTESANO.ES,4.6,144,24.90
28/10/2020,Productos Handmade,20,Champú sólido para uso frecuente artesanal y ecologico - 100% natural y vegano,4.6,33,7.90
28/10/2020,Productos Handmade,21,Búsqueda del tesoro en el jardín - en la playa o casa/jardín – 7-12 años - para fiestas de cumpleaños – juegos para niños,,,15.99
28/10/2020,Productos Handmade,22,Caja de música de Mi vecino Totoro. El regalo para los fans de entrañable película de Miyazaki.,4.7,92,12.85
28/10/2020,Productos Handmade,23,"Puerta Ratoncito Pérez rosa de madera, con escalera,buzón y certificado.Producto artesanal hecho en España",4.6,3,20.95
28/10/2020,Productos Handmade,24,"Saco térmico de semillas personalizado""tela de topitos"". Conocido como cojín térmico. Un producto 100% natural. Semillas de trigo y hierbas aromáticas. Regalo original y hecho a mano",4.8,44,13.95
28/10/2020,Productos Handmade,25,Mascarilla higiénica de tela homologada UNE 0065 mujer con filtro fijo lavable_marca: Brissa España,4.2,23,10.95
28/10/2020,Productos Handmade,26,"Kit Ratoncito Pérez vinilo. Farola y estrellas que brillan en la oscuridad. Puerta mágica, farola y escalera de madera para pintar y personalizar",,,12.95
28/10/2020,Productos Handmade,27,"Jabón facial purificante de arcilla rosa y cacao - 100% ecológico, vegano y hecho a mano",4.4,25,6.90
28/10/2020,Productos Handmade,28,Mascarilla infantil higiénica de tela homologada UNE 0065 niña 10-12 años con filtro fijo lavable_marca: Brissa España,3.4,7,12.00
28/10/2020,Productos Handmade,29,"Puerta Ratoncito Pérez azul de madera,con escalera,buzón y certificado. Producto artesanal hecho en España",4.7,7,20.95
28/10/2020,Productos Handmade,30,"Saco térmico de semillas personalizado""tela de corazones"". Conocido como cojín térmico. Un producto 100% natural. Semillas de trigo y hierbas aromáticas. Regalo original y hecho a mano",4.7,129,13.95
28/10/2020,Productos Handmade,31,Mascarilla higiénica de tela infantil homologada UNE 0065 niño 7-8-9 años con filtro fijo lavable_marca: Brissa España,3.4,10,12.00
28/10/2020,Productos Handmade,32,"Gorro quirófano mujer CALAVERAS MEJICANAS para pelo largo, cirugía, dentista, veterinaria, cocina, etc. Absorbente de toalla en frente, ajustable al gusto con goma y tensor",4.6,41,19.50
28/10/2020,Productos Handmade,33,"Gorros quirófano INSTRUMENTAL MEDICO para Pelo Largo. Tira absorbente en la frente, goma con tensor ajustable fácil y cómodo",4.4,82,19.50
28/10/2020,Productos Handmade,34,"Mascarilla higiénica lavable de tela negra, camuflaje,homologada UNE 0065 hombre con filtro fijo lavable_marca: Brissa España",3.7,34,10.00
28/10/2020,Productos Handmade,35,R-Crea - Mesas de luz Montessori con Certificado de Calidad emitido por la Universidad de Murcia.,4.8,233,90.00
28/10/2020,Productos Handmade,36,"Sello Ex Libris Personalizado de Madera para Libros, 4 Diseños Disponibles, Sello para Libros",5.0,1,21.90
28/10/2020,Productos Handmade,37,Estoy aquí para lo que necesites. I'm here. Mensaje en una botella. Miniaturas. Regalo personalizado. Divertida postal motivación.,5.0,1,9.00
28/10/2020,Productos Handmade,38,"Gorro de quirófano mujer FLAMENCOS ROSAS para pelo largo, cirugía, dentista, veterinaria, cocina, etc. Toalla en frente, ajuste perfecto tensor y cabe todo el pelo",4.8,31,
28/10/2020,Productos Handmade,39,Caja de música azul de los Beatles. Canción Here comes the sun,4.0,10,12.85
28/10/2020,Productos Handmade,40,Tesla Poster de Patente - Conjunto de 6 Impresiones - Patent Print Póster Con Diseños Patentes Decoración de Hogar Inventos Carteles - Marco No Incluido,,,16.00
28/10/2020,Productos Handmade,41,"Vela bautizo unisex de cera blanca, vela primera comunion,decorada con lazo color blanco y flor 35 cm.",4.4,10,18.60
28/10/2020,Productos Handmade,42,Ccasanova | Cartera para hombre | Piel de Ubrique | Billetero y Tarjetero | Hechas a Mano en España | RFID | 14274 Negro,5.0,9,33.99
28/10/2020,Productos Handmade,43,CORONA DE TELA PARA PRIMER CUMPLEAÑOS INFANTIL NIÑA LUNARCITOS ROSA Y DETALLE ESTRELLA ENTREGA 1 O 2 DÍAS,5.0,1,17.00
28/10/2020,Productos Handmade,44,"Ratoncito Pérez. La auténtica puerta mágica. Con una preciosa bolsita de tela azul para dejar el diente. El Ratoncito Pérez, vendrá a por tu diente y dejará una monedita.",4.7,109,9.80
28/10/2020,Productos Handmade,45,"Nombre decorativo infantil de madera natural para habitación dormitorio de niño, niña, regalo nacimiento, bautizo, comunión, aniversario.",4.6,3,24.99
28/10/2020,Productos Handmade,46,"Saco térmico de semillas de trigo Sacatusaco con funda, modelo plegable para calor y frío. Aroma a lavanda 100% natural, con tamaño 50x20cm. Colección Super Happy",4.6,79,18.95
28/10/2020,Productos Handmade,47,Colgante medalla de San Benito,5.0,2,2.92
28/10/2020,Productos Handmade,48,"Pack de 2, Cubrebocas para Niñas 6-9 Años, Hecho a Mano de 100% Algodon, Cubre Boca de Alta Calidad",,,6.39
28/10/2020,Productos Handmade,49,Adorno bola de Arbol de navidad personalizada. Hecha en España,,,4.50
28/10/2020,Productos Handmade,50,COLGANTE TALLADO HADA EN LUNA,4.7,22,13.75
28/10/2020,Productos Handmade,51,Comedero para pájaros 'Wengué',4.4,486,14.95
28/10/2020,Productos Handmade,52,Mascarilla infantil de tela higiénica homologada UNE 0065 niño 10-12 años con filtro fijo lavable_marca: Brissa España,3.5,9,12.00
28/10/2020,Productos Handmade,53,Collar Infinito Te Quiero Mamá Plata de Ley 925 - Colgante para Mamá plata,4.2,38,19.79
28/10/2020,Productos Handmade,54,★ CREOLES AROS DE BRONCE TURQUESA Y PIEDRA DE HOWLITE ★ TURQUESA PENDIENTES,4.0,1,9.90
28/10/2020,Productos Handmade,55,Punto de libro personalizado,4.8,30,18.00
28/10/2020,Productos Handmade,56,"LLAVERO de supervivencia ESPAÑA, con mosquetón llave hexagonal y abrebotellas, color NEGRO.",5.0,2,10.95
28/10/2020,Productos Handmade,57,Mascarilla higiénica infantil homologada UNE 0065 bebé 3-4 años con filtro fijo lavable_marca: Brissa España,4.2,8,12.00
28/10/2020,Productos Handmade,58,Rosa Eterna de Hierro Forjado Roja - Forjada a Mano,4.6,151,29.95
28/10/2020,Productos Handmade,59,"Sello Ex Libris Personalizado de Madera para Libros, 4 Diseños Disponibles, Sello Libros",,,21.90
28/10/2020,Productos Handmade,60,Champú sólido para cabello graso artesanal y ecológico - 100% natural y vegano,4.4,95,7.90
28/10/2020,Productos Handmade,61,"Cojín estrella para bebé personalizado. Un regalo original, decorativo y personalizado. Un bonito detalle para celebrar la llegada de un recién nacido. Hecho a mano",4.5,81,13.95
28/10/2020,Productos Handmade,62,Tabla curva infantil. Juguetes Educativos. Aprendizaje para niños.,4.9,30,89.00
28/10/2020,Productos Handmade,63,"Descapotable Torre de Aprendizaje/Mesa Ste'n'Sit, all-in-one, Montessori learning tower - BLANCO/SILVER clasps",4.8,132,128.00
28/10/2020,Productos Handmade,64,"Pack de 3, Cubrebocas para Adultos, Hecho a Mano de 100% Algodon, Cubre Boca de Alta Calidad, Integradas Puente de Nariz Aluminio",4.0,1,12.59
28/10/2020,Productos Handmade,65,"Puerta Ratoncito Pérez que se abre rosa,con cajita y carta",2.0,1,21.90
28/10/2020,Productos Handmade,66,MARCO para poner en la mirilla de la puerta de la entrada y un adhesivo simulando la MIRILLA.,4.6,17,21.99
28/10/2020,Productos Handmade,67,Ratoncito Pérez puerta Celeste a su casita con escalera y cajita para diente. HECHO EN ESPAÑA,4.6,3,16.95
28/10/2020,Productos Handmade,68,"Saco térmico de semillas de trigo Sacatusaco con funda, modelo plegable para calor y frío. Aroma a lavanda 100% natural y tamaño 50x20cm. Colección Flora.",4.6,40,
28/10/2020,Productos Handmade,69,COLLAR COLGANTE DIENTE TIBURON MINIMALISTA 05 MP,5.0,1,4.95
28/10/2020,Productos Handmade,70,"Gorro de quirofano CORAZONES COLORES, para pelo largo. Tira absorbente frontal y ajustable con tensor y goma a tu gusto Enfermeria Cirugia Odontologia Veterinaria Cocina",4.7,17,19.50
28/10/2020,Productos Handmade,71,★ PENDIENTES HOJA ★ pendientes en grandes hojas,4.1,15,
28/10/2020,Productos Handmade,72,Rosa Eterna de Hierro Forjado Plateada - Forjada a Mano,4.8,90,29.95
28/10/2020,Productos Handmade,73,"Pulsera de supervivencia ESPAÑA a medida 5 en 1 con silbato, brújula, pedernal, raspador y cuerda de paracord 550 tipo III. Hecha a mano en España. Color ÁRIDO PIXELADO.",5.0,3,9.95
28/10/2020,Productos Handmade,74,Pitillera para tabaco de liar - Funda Tabaquera Wild,4.7,42,16.99
28/10/2020,Productos Handmade,75,R-Crea - Mesa de luz Montessori RGB 48x37x7 Color Natural - Certificadas por la Universidad de Murcia,4.2,5,90.00
28/10/2020,Productos Handmade,76,Tabaquera de tela japonesa - Funda Pitillera para tabaco de liar,4.7,572,17.90
28/10/2020,Productos Handmade,77,Jabón exfoliante de canela y café artesanal y ecológico,4.6,36,4.50
28/10/2020,Productos Handmade,78,Pendientes climbers clave de Sol Plata de Ley - Pendientes trepadores plata,3.4,8,12.90
28/10/2020,Productos Handmade,79,"Gorros de quirófano FLORES pelo largo, cirujana, dentista, veterinaria, cocinera. Toalla en frente, ajustable fácil con tensor",4.9,10,19.50
28/10/2020,Productos Handmade,80,PITIS&LILUS CORONA TELA CUMPLEAÑOS INFANTIL NIÑA ROSA CON LUNARCITOS NÚMEROS 1 AL 9 INCLUIDOS ENTREGA 1 O 2 DÍAS,4.8,16,22.00
28/10/2020,Productos Handmade,81,"Corona cumpleaños animales de la jungla, regalo de cumpleaños niños",4.6,13,
28/10/2020,Productos Handmade,82,"Corona bebe cumpleaños unisex, corona de tela de dibujos de los animales de la selva",3.3,3,25.00
28/10/2020,Productos Handmade,83,"Hecho a mano - Pulsera de cuero para mujer hecho por Intendenciajewels - Pulsera bohemia - Joyas para mujer - Pulsera de cuero y plata - Pulsera ajustable de 16-19,5 cm.",,,22.00
28/10/2020,Productos Handmade,84,Ccasanova | Cartera para hombre con Monedero | Piel de Ubrique | Billetero y Tarjetero | Hechas a Mano en España | RFID | 14263 Marron,4.7,26,37.99
28/10/2020,Productos Handmade,85,Puerta Ratoncito Pérez gris QUE SE ABRE con escalerita y recibos oficiales,5.0,3,20.00
28/10/2020,Productos Handmade,86,Collar con mensaje para regalar a tu hermana Plata de Ley 925 - Regalos para hermanas,5.0,4,19.95
28/10/2020,Productos Handmade,87,NAVAJA PERSONALIZADA CON TU NOMBRE. Incluye estuche personalizado de madera. IDEAL PARA REGALO,4.7,46,16.95
28/10/2020,Productos Handmade,88,Nombres personalizados en madera para decoración y hogar • Nombres Decorativos en madera natural y con texturas a color !! • 30 cm | 40 cm | 50 cm,4.3,23,8.90
28/10/2020,Productos Handmade,89,"Gorros Dentista INSTRUMENTAL ODONTOLOGÍA, para Pelo Largo. Tira absorbente en la frente, goma con tensor ajustable fácil y cómodo",4.5,36,19.50
28/10/2020,Productos Handmade,90,Hadas y Estrellas Chicas Personalizado Nombre Mural Pegatina de Pared,4.6,366,20.99
28/10/2020,Productos Handmade,91,Rosa Eterna de Hierro Forjado Roja y Plateada - Forjada a Mano,4.7,54,29.95
28/10/2020,Productos Handmade,92,Colgante personalizable hecho a mano de Trébol de Cuatro Hojas Natural en Resina – Cadena plateada de Acero Inoxidable,,,
28/10/2020,Productos Handmade,93,Corona Cumpleaños Peppa Pig,5.0,2,26.00
28/10/2020,Productos Handmade,94,"Bola de Navidad personalizada con nombre. 100% en madera MDF. Diseñado, vendido y enviado por VPM Original. 100% Producto español.",4.5,2,4.95
28/10/2020,Productos Handmade,95,Marcador ropa niños personalizado sello infantil guardería,4.4,21,20.90
28/10/2020,Productos Handmade,96,"Collar Transparente con Semillas de Diente de León, Colgante de Esfera Cristalina, Regalos originales",,,32.00
28/10/2020,Productos Handmade,97,"Gorro quirófano hombre CORAZONES, médico, dentista, veterinario, cocinero. Absorbente en la frente, ajustable al gusto con tensor y goma",4.0,2,17.90
28/10/2020,Productos Handmade,98,Champú sólido para cabello seco artesanal y ecológico,4.6,34,7.90
28/10/2020,Productos Handmade,99,Corona de cumpleaños unicornio personalizada,5.0,17,26.00
28/10/2020,Productos Handmade,100,Hombre Collar Hematita Ónice Cuentas de lava orata cruz con jesus acero 316L de piedras preciosas Collar rosario,,,21.00
28/10/2020,Productos para mascotas,1,"Greener Walker Bolsas para Excrementos de Perro,540 Unidades,Extra Grueso,Fuerte y 100% a Prueba de Fugas Biodegradable Bolsas para Caca de Perro(Marrón)",4.7,5493,16.99
28/10/2020,Productos para mascotas,2,"AmazonBasics - Toallitas de entrenamiento para mascotas (tamaño regular, 100 unidades)",4.4,49400,14.19
28/10/2020,Productos para mascotas,3,"Sanicat clumping + marseille soup 10L, azul",4.2,1659,5.31
28/10/2020,Productos para mascotas,4,AmazonBasics - Bolsas para excrementos de perro con dispensador y clip para correa (300 bolsas),4.8,45628,12.09
28/10/2020,Productos para mascotas,5,"Bedsure Cama Perro Extra Grande Ortopédica - Colchón Perro Lavable Verano XL, Desenfundable con Espuma De Caja De Huevos, 112x81x7.6 cm",4.5,3520,25.99
28/10/2020,Productos para mascotas,6,Purina Gourmet Gold Fondant comida para gatos con Atun 24 x 85 g,4.7,588,11.49
28/10/2020,Productos para mascotas,7,"True Instinct Original - Pienso para Gatos Kitten con pollo - 1,25kg",4.7,184,8.75
28/10/2020,Productos para mascotas,8,"Earth Rated - Pack de bolsas para recoger excrementos de perro, Olor a Lavanda , 8 Rollos (120 unidades)",4.8,12573,6.30
28/10/2020,Productos para mascotas,9,"Pecute Comedero para Gatos Perros Mascotas de Acero Inoxidable 12oz/800ml con Pala de Comida, Base de Silicona Antideslizante",4.6,4615,11.99
28/10/2020,Productos para mascotas,10,"dibea Árbol rascador para Gatos, 112 cm (Beige)",4.4,7688,32.09
28/10/2020,Productos para mascotas,11,Sanicat Select Mediterranea Arena de Gatos Ultra Aglomerante - 15L,4.3,1129,10.49
28/10/2020,Productos para mascotas,12,"Iris Ohyama, arena para gatos con pala - Cat Litter Box - plástico, gris, 38 x 48,5 x 30,5 cm",4.6,4527,15.99
28/10/2020,Productos para mascotas,13,"Zubita Rascadores para Gatos, Árbol para Gatos Arañazo Gatos Juguetes de Sisal Natural, Cat Toy Centro de Actividad para Gatitos con Peluche",3.6,1991,7.44
28/10/2020,Productos para mascotas,14,rabbitgoo Arnes Perro Grande Mediano Pequeño Arnés Pecho Antitirones Perros Coche con Lineas Reflectantes Cómodo Transpirable Chaleco Acolchado Ajustable para Adiesreamiento Correr S Amarillo,4.5,43733,19.49
28/10/2020,Productos para mascotas,15,"Cozywind Cama Gato Suave Cama Perro Redonda,Mascotas Calentito Cojín Lavable Invierno de Felpa,Diámetro 50cm,Gris Claro",4.5,670,19.99
28/10/2020,Productos para mascotas,16,AmazonBasics - Bolsa mejorada para heces de perro con aditivos EPI y dispensador y pinza para correa - 270 unidades,4.8,27823,10.39
28/10/2020,Productos para mascotas,17,Purina Gourmet Gold Bocaditos en Salsa comida para gatos con Pollo e Higado 24 x 85 g,4.6,493,10.98
28/10/2020,Productos para mascotas,18,"Bedsure Cama Perro Pequeño Navidad M - Colchon Perro Lavable de Felpa Muy Suave, Sofá de Perro 81x58x18cm, Venado",4.0,1523,23.19
28/10/2020,Productos para mascotas,19,True Instinct No Grain - Pienso sin Cereales para Perro Junior Medium-Maxi con Salmón - 12kg,4.6,180,11.85
28/10/2020,Productos para mascotas,20,"ACE2ACE Quitapelos y Rodillos para Mascotas, Cepillo de Limpieza Removedor de Pelaje para Gatos y Perros, lavable y reutilizable Animales Cepillos Depilación, para alfombras, ropa y sofá",4.5,3982,14.99
28/10/2020,Productos para mascotas,21,"Wodondog Collar de Adiestramiento para Perros Recargable y Resistente al Agua con vibración y Sonido, Rango Remoto de 300 Metros",4.0,797,35.99
28/10/2020,Productos para mascotas,22,100 Empapadores Para Entrenar A Cachorros + 5 Extra GRATIS | 60 cm x 60 cm Nuevo Tamaño Superabsorbente | Esta Nueva Y Unica Solución De 5 Capas Protege Las Alfombras De Los Suelos Laminados Del Olor,4.5,4047,26.97
28/10/2020,Productos para mascotas,23,Pecute Cama de Perros y Gatos Básica Cama de Suave Gamuza para Perros y Gatos de Color Gris S(53 * 43cm),4.3,3008,18.39
28/10/2020,Productos para mascotas,24,Pienso para Gatos Esterilizados Adulto con Salmón - 3kg,4.8,871,12.49
28/10/2020,Productos para mascotas,25,LYL Etiquetas de identificación de Mascotas de Acero Inoxidable Etiquetas de Perro Personalizadas Personalizadas Grabado Frontal/Posterior para Gato y Perro con Diferentes Formas,4.6,5822,4.99
28/10/2020,Productos para mascotas,26,"KEKU LED Collar de Perro de Mascota, llevó USB Recargable Collar de Seguridad para Mascotas Impermeable hasta la Longitud de 50 cm (19.5in) Collar de Destello Ajustable (Amarillo)",4.1,1614,7.99
28/10/2020,Productos para mascotas,27,"Karlie 51739 Sanitario Gato, 52 x 39 x 41 cm, Azul",4.4,653,18.69
28/10/2020,Productos para mascotas,28,"AIXMEET Bolsas Caca Perro, 600 Bolsas de Compost para Perros con 1dispensador(32X22cm)",4.5,2027,16.99
28/10/2020,Productos para mascotas,29,ADVANCE Light Pienso para Perros Mini - 3kg,4.7,447,13.90
28/10/2020,Productos para mascotas,30,"Bonve Pet 2x400ML Comedero para Perro Gato y Mascotas de Acero Inoxidable con Base de Silicona Antideslizante, 2 Cuencos Comedero para Comida y Agua",4.4,2760,9.81
28/10/2020,Productos para mascotas,31,"QiCheng&LYS Adidog Dog Hoodie Ropa, Mascota Cachorro Gato algodón Lindo cálido Sudadera con Capucha suéter (XS, Amarillo)",4.1,3001,8.88
28/10/2020,Productos para mascotas,32,Árbol rascador árbol para escalar árbol rascador para gatos altura 85 cm beige,4.5,4663,27.81
28/10/2020,Productos para mascotas,33,"Cat's Best, Arena para gatos Cat 's Best Eco Plus, 1x 2.1 kg",4.5,2816,5.74
28/10/2020,Productos para mascotas,34,Purina Gourmet Gold Mousse comida para gatos con Buey 24 x 85 g,4.7,985,10.29
28/10/2020,Productos para mascotas,35,"AmazonBasics - Empapadores de adiestramiento para perros, carbón, normal, 120 unidades",4.2,7789,14.09
28/10/2020,Productos para mascotas,36,Pedigree Pack de Dentastix de uso Diario para la Limpieza Dental de Perros Grandes (4 Packs de 28ud),4.7,804,15.59
28/10/2020,Productos para mascotas,37,"ADVANCE Veterinary Diets Atopic - Pienso para Perros Mini con Problemas Atópicos - 1,5Kg",4.7,445,9.35
28/10/2020,Productos para mascotas,38,"Sanicat Arena De Gato, Ultra Aglomerante, Aroma A Loto, Azul - 5.25 kg.",4.3,825,6.99
28/10/2020,Productos para mascotas,39,"ultima Pienso para Gatos Junior de 2 a 12 Meses con Pollo, Pack de 6 x 400 gr - Total 2.4 kg",4.7,137,10.90
28/10/2020,Productos para mascotas,40,"Brekkies Pienso para Gatos con Buey, Ternera y Verdura - 4000 gr",4.6,578,6.99
28/10/2020,Productos para mascotas,41,"Dokkita Quitapelos y Rodillos para Mascotas, Cepillo de Limpieza Removedor de Pelaje para Perro y Gato + 2 Lavadoras de Pelo Reutilizables Lavadora, Mágico Depilación Eliminador de Pelo para Animales",4.3,246,11.19
28/10/2020,Productos para mascotas,42,Idepet (TM Abrigo aprueba de Agua de Perro para Invierno Ropa para Perros pequeños medianos y Grandes Mascotas Tallas S M L XL XXL 3XL 4XL 5XL,4.3,3522,12.99
28/10/2020,Productos para mascotas,43,"Zellar Impermeable para Perros con Capucha y Collar Agujero y Tiras reflectoras seguras, Ultra-Light Transpirable Impermeable 100% Chaqueta para Lluvia medianos Perro de Raza Grande",4.3,4259,14.99
28/10/2020,Productos para mascotas,44,"ADVANCE Pienso para Gatitos Kitten - 1,5kg",4.7,292,11.30
28/10/2020,Productos para mascotas,45,Pedigree Pack de Dentastix de uso Diario para la Limpieza Dental de Perros Pequeños (1 Pack de 112ud),4.6,2518,14.00
28/10/2020,Productos para mascotas,46,"AquaClear Sistema de Filtración 70, 300",4.4,7911,19.43
28/10/2020,Productos para mascotas,47,MENFORSAN Champú Perros Aloe Vera - 300 ML,4.6,829,3.59
28/10/2020,Productos para mascotas,48,Pecute Cortaúñas Gatos Profesional de Acero Inoxidable para Perros Mascotas Pequeños y Conejos,4.6,2416,6.99
28/10/2020,Productos para mascotas,49,"Arquivet arena gato Silica Crystal 7,6 L",4.4,185,8.13
28/10/2020,Productos para mascotas,50,"SlowTon Arnés de Coche para Perros con cinturón de Seguridad, Arnés de Seguridad para Perro, arnes Perro,Correa elástica Ajustable y Forro de Tela Transpirable en el vehículo",4.5,6026,10.86
28/10/2020,Productos para mascotas,51,"Friskies - Gato Junior con Pollo, Leche y Verduras añadidas, 1,5 Kg",4.5,259,3.86
